Unnamed: 0,recommendationid,language,review,timestamp_created,timestamp_updated,voted_up,votes_up,votes_funny,weighted_vote_score,comment_count,steam_purchase,received_for_free,written_during_early_access,steamid,num_games_owned,num_reviews,playtime_forever,playtime_last_two_weeks,playtime_at_review,last_played,appids,sentiment
Speaking of classes, you’ll have plenty of styles to explore: your characters can have one of fifteen different “professions” (with unlockable alternates you can unlock with souls, a currency that drops from bosses). Although they all fall under three major categories (melee, ranged or caster) there are significant playstyle differences between them: the Chef, for example, can return most projectiles in a volley with his pan and his self-healing class ability ensures a lot more resilience while exploring - as opposed to the Boxer, for example, who despite also being a melee warrior has a much more rushdown-oriented playstyle, increasing his damage as he achieves a higher combo counter. 
   

[h1]A World of Pain[/h1]

https://steamcommunity.com/sharedfiles/filedetails/?id=2812564349

The underground dungeon you have to explore is randomized with every death, but retains a general sprawl of six different areas, each with their own boss and thematic enemies. Traps, resolve management, “fatal” artifacts, spikes, enemies will kill you over and over again, but there’s a clear sense of progress and a drive to not repeat mistakes that keeps you going forward. There’s enough mechanical depth and variety to keep you going for a lot longer than the thin-paper plot and scarce worldbuilding. The art direction is consistent and makes great use of tones to convey mood in every area: from the horizontal, side-scrolling sprints through Axis Mundi (the second area) to the tight vertical platforming of the Sun Tower, there’s a lot of memorable moments empowered by the craft and sweat of the artists who conceived this world.
	By the time you’ve cleared your first playthrough, the game will seem fairly easy - whether because you have quick reflexes and a good grasp on how to avoid damage, or because you’ve dumped literal tonnes of gold, ore and aether into your castle wings, runes and gear. No matter - in true roguelike fashion, New Game+ includes a plethora of handicaps you can activate, a Prime mode for every boss (an improved version of them), which you have to finish numerous times in order to reach the game’s “true” ending, and no matter how much you upgrade at one point you’ll simply have to learn the actual dance.

	https://steamcommunity.com/sharedfiles/filedetails/?id=2812564527

	An aspect that often defines a roguelike’s life expectancy is how grind-oriented it is, and Rogue Legacy lets you take a pretty relaxed approach to it. There are bottlenecks, of course, but most of them are simply skillchecks. Sure, you can spend an hour or two doing gold runs and filling up your coffers before you engage the same boss with more damage, mana and a larger health pool, but you’ll probably be faster just trying out the bossfight until you can do it perfectly. I never felt like I was being held back by raw values as much as I was incorrectly using the screen space and abilities to avoid incoming damage, which is what boss fights are all about. In that regard, you can avoid grinding altogether if you’re quick and fast learning enough.
	The colorful, cartoonish graphics and genre-savvy music and sounds are exactly as shown on the cover - a modern, less pixelated facelift applied to the style and vibe of the original title. The design is clear and projectile types are often color-coded, while enemy types directly reference the designs of skeletons and floating mages I oddly remember from playing the first game almost eight years ago. 
	Rogue Legacy 2’s strength is its gameplay. It’s fun whether tackled in small or big sessions and while its sense of novelty will wear out quickly, you’ll find yourself playing long after that, fueled by its engaging platforming elements and fast-paced combat. It’s admirable how balanced and fine-tuned the game is - almost as if it knows when to spike up the difficulty in order to motivate you - and it allows a soft sliding difficult scale through its House Rules feature, a customizable difficulty panel ensuring that even newcomers to the genre can see the adventure through. 

[quote]Follow our Curator page, [url=https://store.steampowered.com/curator/41449676/] Summit Reviews [/url] , to see more high-quality reviews regularly.[/quote]",2022-05-25 19:43:48,2022-05-25 19:46:35,True,30,2,0.7391619682312011,3,False,False,False,76561197994624438,576,23,3567,250,2405,1655750988,1253920,positive
223,116060957,english,"Played the 1st one,  loved it, inspired many a decade of ""roguelike"" and ""roguelite"" saw the 2nd one come out of EA,  bought the crap out of it.
Got my ass kicked a lot, Got Gud, did stuff, 100% achievement,  heard credits.  Cried.  A deep internal cry because I finished it. 
Thank you so much for inspiring this genre of games.
",2022-05-26 22:47:22,2022-05-26 22:47:22,True,12,2,0.6739990711212158,0,True,False,False,76561198010170463,217,31,4259,0,4259,1653604265,1253920,positive
224,116269915,english,"Starts out great, fun like the first game. And then the game keeps going. And escalating in frustration. Gold costs for upgrades scale so fast that grinding earlier areas for an advantage is worthless and enemies in the later stages can kill you in a second. It makes the game feel unfair in a way the original wasn't, and the feeling that you ""could"" win the game even with base stats is completely gone. I wish that the heirlooms and artifacts didn't feel like such minuscule bonuses. Dying pointlessly a half-dozen times to earn a 1% health bonus while waiting for an heir that has a useful set of abilities just doesn't feel good.",2022-05-31 02:32:01,2022-05-31 02:32:01,False,10,0,0.5933831334114074,0,True,False,False,76561198005616069,743,21,1369,0,1369,1653963170,1253920,negative
225,116714556,english,"Rogue Legacy 2 is an excellent follow-on from the first. Some of minor annoyances from the original have been dealt with and the game caters to a broad spectrum of play styles and ability levels.

The number of areas has increased from 4 to 6 and the areas feel unique, rather than reskins of the same template. One zone in particular has a lot of verticality which is great fun for those into platformers. There are also exploratory side missions that rewards you with additional lore, bonus challenges, and damage buffs against bosses. 

The classes in the original were more-or-less the same, just with different stats, but that's not the case now. Each class plays completely differently. I really enjoyed the boxer who has a combo meter and can float in the air while their rapid punches are making contact with the enemy! Additionally, there is an ability fairly early in the game which can lock a class to one of your heirs, so if there's a particular class you really enjoy, then you can keep using them. Although bear in mind that there are rewards for using a variety of classes in the form of stat bonuses.

You will always be in a situation where you can progress. In the original, I sometimes found myself having a series of bad runs and never having the money to upgrade abilities. That's no longer the case now as there is a magic safe that will store a small proportion of your money before you start a new run. So even if you have a series of bad runs, you will eventually have enough money to upgrade something.

You can progress through the NG+ at your own pace. I won't give away too much about NG+, but if you feel like you have bitten off more than you can chew, you can dial it back at any time. 

A few minor things about the game:
-I miss the circus minigames from the original. I'm guessing they would have been a bit of an atmosphere killer in this, but it would have been nice to have an alternative. I suppose some of the charm chest rooms were similar, but I enjoyed the lighthearted respite in the original!
-I liked the miniboss trap room in the original (with the Doomvas) and I was kinda hoping there would be more of that kind of stuff in this one.

And one tiny annoyance:
-The UI in the Scars of Erebus is a bit awkward. It would be nice for the cursor to remember which challenge you were on (for when you're retrying the same challenge) and it would be nice if there was an easier way to check individual class scores for each challenge rather than having to press 'Y/Triangle' over each scar. (E.g. Have a table that has the classes as rows, scars as columns, with all the scores in the cells, and totals at the end. This is so you can quickly check which classes/challenges have been neglected).

Aside from that, a solid 9/10 for me! Thanks guys, well worth the wait :)
",2022-06-09 09:27:45,2022-06-09 09:27:45,True,5,0,0.5883508920669555,0,False,False,False,76561197969441585,613,7,8118,23,8041,1654965537,1253920,positive
226,116615938,english,"Amazing game. Perfect blend of Roguelite mechanics, platforming, progression and puns.

Gameplay Loop:

1) Select from a list of 3 characters. Each characters usually have a bonus or a negative trait (which give a gold bonus) attached to them.
2) Get ready for your adventure the usual way (shopping, equipping runes, talking to NPCs, playing mini games)
3) Explore the castle visitng various stages. This allows you to progress the storyline, get various types of currency, get artficat, etc
4) Did you die? Did you killed the last boss? If so, go back to 1. 

Why I whole heartily recommend this game:
- The difficulty is great. I felt the game was a perfect blend of frustrating and fun. If you don't like game where you are award for pattern recognition then this game might not be for you. Plus in the NG+ mode you get a Hade-like select the buffs the enemy get. 
- The grinding isn't there. you might hear about the grinding in this game and I'm here to tell you it isn't true. If you're good then you don't need to grind but if you're not so good (like me!) or just like experimenting then you get rewarded with your failures. I never felt grinding was a means to an end.
- Movement powers. The dashes, air dashes, air stomp and double jumping(+) feels really good. 
- The hit box in this game is well done. It's a weird thing to mention but the hit box seems to be perfect. There was never a time that I thought I got hit when I shouldn't. This isn't a big thing but you'll never know how much you miss it until you play a game with a bad hit box.
- Progression system. So much stuff to unlock and explore. Even when you die, you feel like you got something for it. 

100% achievement takes around 80 hours? Probably less if you're good at this type of game. 
Honestly I wasn't trying for achievement in this game I was having such a good time. It sorta of just happened.

I give this game 8 thread out of 8. 
",2022-06-07 05:10:32,2022-06-07 05:10:32,True,4,1,0.5851292610168457,0,True,False,False,76561197996908192,778,36,9124,0,9124,1654579132,1253920,positive
227,116646364,english,"From the devs of one of the few examples of procedural Roguelite done right, comes an example of... procedural Roguelite done better. There is no other way to slice it - Rogue Legacy 2 is just Rogue Legacy 1, but bigger and more polished.

You're still picking a new heir with different quirks for each run, still going trough a randomly-assembled dungeon collecting cash, and still spending that cash on permament upgrades in between rounds. Your goal is still to defeat each of the bosses one at a time, until you unlock the final one and move on to New Game+. The nitty-gritty in between, however, is where the game was expanded substantially.

There is a bigger emphasis on movement abilities, which you will unlock in the course of runs, metroidvania-style. Each class now has its own unique weapon and playstyle, expressed in a far deeper stat system. A new relic system adds lots of wacky twists and modifiers to each individual run, which you will need to experiment with to prepare for the far more complex bossfights. All done in much better visuals and sound.

But the usual trappings of Roguelite still apply - there will be instances of deep frustration with the RNG, as well as times where you feel like you're just spinning your wheels on the gold grind. Many a run will end prematurely simply because you decided to try a new thing, and screwed yourself over. And then of course you will get that one ""god run"" that feels ecstatic. If those trappings are a hang-up, Rogue Legacy 2 won't convince you otherwise.",2022-06-07 19:52:28,2022-06-07 19:52:28,True,4,0,0.5790640711784362,0,True,False,False,76561198050749385,186,54,2150,169,1922,1655151776,1253920,positive
228,117134250,english,"The gameplay loop of making a run through the castle and upgrading after each death is really satisfying and addicting, even after 100+ hours. I already loved the original Rogue Legacy and this one is even better. It impressed me how balanced most of the classes are. For example, I thought I would hate Ranger but after a particularly good run it became one of my favorites, and Chef is a life saver against a room full of projectiles. 

Also, the Relic/Resolve system is a great addition, sometimes I would really have to stop and think for a minute if adding poison to my weapon or boosting my super-critical chance was worth dropping under 100% Resolve and losing some max health.",2022-06-17 16:37:03,2022-06-17 16:37:03,True,3,0,0.5736824870109558,0,True,False,False,76561197995189975,104,1,11038,2938,11038,1655481564,1253920,positive
229,116539201,english,"I had literally 0 expectations about this game, mainly because I bought it cuz of an inner-joke, [i] but damn... [/i]

still struggling with NG+

9/10",2022-06-05 18:22:50,2022-06-05 18:22:50,True,5,1,0.5700637102127075,0,True,False,False,76561198137261464,334,11,5440,1381,3697,1655670056,1253920,positive
230,116648102,english,"I wish I could rate this just okay or so-so. Rogue Legacy 2 certainly has more than the original Rogue Legacy, but it's not necessarily more GOOD. The more I play it, the more I am led to believe that the developers were never entirely sure what lightning in a bottle they captured that made the first installment so successful, and as a result have simply dialed up everything to 11 hoping that something will stick. There's more classes, weapons, skills, enemies, etc., but there's ten times the amount of garbage you will have to deal with experiencing it.

The grind is obviously part of the experience of this game, and is put front-and-center with the iterative upgrades you buy after each run attempt, but feels orders of magnitude worse than the previous title. The risk-reward proposition in this game is abysmal. The game will highly discourage you from taking any risks and instead you will quickly find that you will amass much more treasure and experience by steamrolling lower-difficulty areas over and over rather than attempting somewhere more challenging, where you will eventually be killed in two or three hits. Damage can come from anywhere, and projectiles often move faster than you can react, with projectiles or traps coming from offscreen to whittle a third of your health down after you've already scoped out your plan for things on the screen. The end result is often expending your mechanical resources of an extra jump or dash to cleanly eliminate what is on screen, but now that you air in midair and have those mechanics disabled until you touch down, you can easily be tagged by new things that have entered the screen after executing your plan. Normally having to react to things is such a standard part of video games that it seems almost ridiculous to mention something like this at all, but it will happen to you SO MUCH in RL2 that it bears mention. You WILL be tagged by things coming from offscreen, you WILL be hit by attacks that make no sense, and you WILL die to BS, over and over again. To some people, this grind can be exciting, as it becomes more akin to gambling, hoping to get lucky and not spin bankrupt rather than outplaying the enemies, but to me I find it tedious.

Enemy telegraphs in this game are abysmal, and I don't mean in the ""enemy makes a windup motion and then you react"" sense. I mean, an enemy will clearly show that they are executing some sort of attack, but instead of it being something you can safely react to or learn from, it will suddenly be a fast-moving projectile that will shoot through walls to hit you. Why does an enemy who only appears to have a melee weapon have an attack like this? Why do some projectiles go through walls and others don't? There's dozens of overengineered mechanics in this game ranging from several kinds of weights and how they affect what you can pick up without ruining your max health, down to several currencies, bonuses, debuffs, and all these things which should really just be taking a backseat to the hack and slash mechanics. I doubt many players care that their new armor gives them plus seventeen smeerps instead of fifteen, when the areas you want to explore will still kill you in three hits. The upgrades are so incrementally tiny, it feels like garbage even sinking points into any of them at all.

There's simply so much crammed into this game that don't strictly make it better that bothers me. There's lore books shoehorned in in the most hamfisted manner, sidequests which are vague enough that even when you know exactly what a riddle is referring to, you will still fail because you were standing two inches too far away to trigger a secret door. Just google this stuff, it's legitimately not worth trying to solve the riddles, especially since it just leads to more ways to obtain more nonsense currencies that let you buy more tiny upgrades, seriously, sometimes simplicity is better.

Multiple runs in this game are tiring and overtly repetitive, something that is not good for a roguelite or any game that has ""rogue"" so brazenly spotlit in the title. I want to experience all this game has to offer but this gameplay loop is trying my patience and you can get about triple the dopamine per run in many other similar roguelites. RL2 isn't bad, it's not great, and it really is just about as okay as RL1, with a more convoluted path to the golden gameplay loop that seems to take the backseat. Sometimes simplicity is best, and I honestly feel stripping about 50% of the stuff from this game would make it objectively a more fun experience.",2022-06-07 20:39:33,2022-06-07 20:39:33,False,5,0,0.557375431060791,0,True,False,False,76561198001528028,617,14,1974,573,991,1655242318,1253920,negative
231,116994280,english,"Back when Rogue Legacy 1 was what we had, i felt like there wasn't much to be done with the formula. The Game was simple and fun, and scratched an itch for Roguelike lovers. Now, with RL2, the original feels like a prototype at best. Everything good has been improved, the bad trashed, and what wasn't there has been added. The developers have listened to the players and improved the game on many accounts after release, balancing, tweaking and adding quality of life features. Players of the original game and those unfamiliar with the series will both be able to enjoy it.",2022-06-14 22:04:19,2022-06-14 22:04:19,True,2,0,0.5454545617103576,0,True,False,False,76561198054520013,80,3,5223,728,5029,1655503940,1253920,positive
232,116683161,english,"This is that good good. Its got everything you need. If you are a fan of metroidvanias and roguelikes, get this. If you don't like 2D, then don't get it. If you don't like 2D go play something else and get out of my face already. Go buy some soulless, souped up, triple-A shooter so that you can have strangers tell you that you are worthless during competitive play. Or change your way, convert, and play something fun like Rogue Legacy 2. Or Tunic. Play Tunic too.",2022-06-08 16:30:14,2022-06-08 16:30:14,True,2,1,0.5454545617103576,0,True,False,False,76561198040559700,18,1,21026,12639,6297,1656085525,1253920,positive
233,116714389,english,"[b]TL;DR[/b] Foundationally great game, brought down by a lot of smaller issues. If youre looking for a solid rogue-like to grind out, its not a bad choice for a game. However if youre experienced in these sorts of games you might find a lot of smaller things that will hinder your enjoyment.



MILD GAMEPLAY SPOILERS AHEAD

This isn't really a ""not recommended"" but as steam doesnt have a mid option, this is what im going with.

this one hurts, genuinely. Rogue Legacy 1 is a game i still hold dear to my heart as it was the first game that i consciously played as an ""Indie Game"" and got me started to look deeper into smaller games. (i think it also was my first rogue-like, but not 100% if i didnt play BoI first)

So let me start this out by saying this: If you're looking for a foundationally solid rogue-lite experience with great art and some quirks, this game is not a bad choice by any means, and you can certainly have fun with it.

However, while I replayed RL1 a bunch of times, including beating the game in just a couple generations and going into NG+[high number i dont remember] , at some point i decided to just get through the rest of the game and be done with it, and now that im done, i have no desire to ever open it up again and very mixed feelings if i actually enjoyed these 18 hours.

[b]1) Professional Polishers[/b]

So where are the issues? Honestly, Its hard to pin down but there are a lot of smaller things that add up. Like already said, the graphics are great, the foundation is solid, the controls are responsive, the basic combat is polished...

...but here we come to our first and main type of issue: Everythings just a little too polished. I firmly believe that rogue-likes are a genre that shouldnt be polished too much. It requires unbalanced things, it requires quirky moments, it requires useless but fun roads to go down. Binding of Isaac is maybe the most unbalanced rogue-like ever and maybe the greatest, so that should tell you somethings. The nature of it is that it builds on randomness and variety.

Heres an example of what i mean: RL1 had traits that made the game way harder (think vertigo) for no compensation whatsoever. Does that mean vertigo was a bad addition to the game? I would argue no, i still picked a vertigo character occasionally for funsies. RL2 meanwhile introduces welfare, meaning you get a percentage money bonus depending on how bad a trait is. No more funsies, now thats a balanced tradeoff. (it also feels like theres way less traits, the amount of times ive looked at my options and all 3 had no traits was baffling to me)

This extends to other parts of the game as well. Another Example: You have a relic system thats expanded way beyond what RL1 had just so you can give the player 10% bonus damage in certain situations. Also you can only have so many relics before your HP takes a hit, how much is correlated to your equipment. Why have it be this advanced and then barely affect the gameplay? Except for 1-2 runs the relics felt absolutely pointless.

Locking class, rerolling and more options so you can always have pretty much the exact character you want! sounds great right? until you realize it ruins the variety of the game while being the theoretical best play.

[b]2) Metroidvania?[/b]

The game tries to go into the metroidvania direction but leaves very little room for exploration early on. you get an heirloom, you unlock one new area, where you get an heirloom that unlocks the next area... The game even straight up tells you ""this is area number X"".

It feels like its being done just for the buzzword and less for its actual contribution to the gameplay. And its made worse by...

[b]3) Grinddddddd [/b]

Now i wanna reiterate that while i make it sound like these are massive fuckups each and every one, none of them are by themselves. If this game for example only had issues with too balanced relics and traits, it would still be a great game. And similarly to the next point: There are definitely grindier rogue-likes out there. However, unless you bang your head against a wall like I did in the end, you'll likely still have to grind. And its just not rewarding. Why exactly is hard to pin down, but i think it comes from the overwhelming amount of things to invest in vs. what you can actually manage in a NG and the in comparison to that fairly quick price increase. Also going back to polish, i noticed in the beginning that with the same money bonus i always ended up with pretty much the exact same amount of money after clearing the citadel out +-100. Which sounds brilliant on paper, but makes the grind even less exciting.

I beat RL1 in just a couple generations without too much issue. This here feels impossible (im sure it isnt actually). It makes the grinding feel mandatory, while in RL1 it felt like an option to make it a bit easier.

[b]4) Variety until there isnt [/b]

Riddle me this: In a sequel, whos main difference is that different classes now have different weapons that work completely differently, why have XP per class? That just points towards maining 1-2 classes and ignoring the rest. Again, the bonus you get from XP is fairly miniscule, like everything here its a minor point, but it pushes you in the imho wrong direction.

Another issue personally is that due to enemies tendency to run into you, classes that didnt allow moving while attacking/stunned you for a second when attacking felt really static and unfun in comparison, which again made me wanna limit myself to just a few classes. For a while i forced myself to pick the other ones regularly but eventually i gave up on that towards the end.

[b]5) combat [/b]

